ID,URL,Title,Difficulty,Acceptance %,Frequency %
1227,https://leetcode.com/problems/airplane-seat-assignment-probability,Airplane Seat Assignment Probability,Medium,66.7%,100.0%
6,https://leetcode.com/problems/zigzag-conversion,Zigzag Conversion,Medium,51.8%,87.5%
844,https://leetcode.com/problems/backspace-string-compare,Backspace String Compare,Easy,49.5%,75.0%
347,https://leetcode.com/problems/top-k-frequent-elements,Top K Frequent Elements,Medium,64.7%,62.5%
121,https://leetcode.com/problems/best-time-to-buy-and-sell-stock,Best Time to Buy and Sell Stock,Easy,55.4%,62.5%
419,https://leetcode.com/problems/battleships-in-a-board,Battleships in a Board,Medium,76.6%,62.5%
2184,https://leetcode.com/problems/number-of-ways-to-build-sturdy-brick-wall,Number of Ways to Build Sturdy Brick Wall,Medium,49.5%,62.5%
46,https://leetcode.com/problems/permutations,Permutations,Medium,80.8%,62.5%
1963,https://leetcode.com/problems/minimum-number-of-swaps-to-make-the-string-balanced,Minimum Number of Swaps to Make the String Balanced,Medium,78.0%,62.5%
