ID,URL,Title,Difficulty,Acceptance %,Frequency %
273,https://leetcode.com/problems/integer-to-english-words,Integer to English Words,Hard,35.0%,100.0%
616,https://leetcode.com/problems/add-bold-tag-in-string,Add Bold Tag in String,Medium,51.4%,75.0%
981,https://leetcode.com/problems/time-based-key-value-store,Time Based Key-Value Store,Medium,49.9%,87.5%
198,https://leetcode.com/problems/house-robber,House Robber,Medium,53.2%,50.0%
2591,https://leetcode.com/problems/distribute-money-to-maximum-children,Distribute Money to Maximum Children,Easy,20.6%,62.5%
