ID,URL,Title,Difficulty,Acceptance %,Frequency %
3,https://leetcode.com/problems/longest-substring-without-repeating-characters,Longest Substring Without Repeating Characters,Medium,39.1%,75.0%
2320,https://leetcode.com/problems/count-number-of-ways-to-place-houses,Count Number of Ways to Place Houses,Medium,43.9%,100.0%
242,https://leetcode.com/problems/valid-anagram,Valid Anagram,Easy,68.1%,62.5%
225,https://leetcode.com/problems/implement-stack-using-queues,Implement Stack using Queues,Easy,69.9%,62.5%
75,https://leetcode.com/problems/sort-colors,Sort Colors,Medium,69.6%,62.5%
3852,https://leetcode.com/problems/smallest-pair-with-different-frequencies,Smallest Pair With Different Frequencies,Easy,69.4%,100.0%
141,https://leetcode.com/problems/linked-list-cycle,Linked List Cycle,Easy,54.3%,62.5%
2434,https://leetcode.com/problems/using-a-robot-to-print-the-lexicographically-smallest-string,Using a Robot to Print the Lexicographically Smallest String,Medium,62.3%,62.5%
