ID,URL,Title,Difficulty,Acceptance %,Frequency %
323,https://leetcode.com/problems/number-of-connected-components-in-an-undirected-graph,Number of Connected Components in an Undirected Graph,Medium,64.8%,100.0%
64,https://leetcode.com/problems/minimum-path-sum,Minimum Path Sum,Medium,67.8%,62.5%
1637,https://leetcode.com/problems/widest-vertical-area-between-two-points-containing-no-points,Widest Vertical Area Between Two Points Containing No Points,Easy,87.1%,50.0%
1570,https://leetcode.com/problems/dot-product-of-two-sparse-vectors,Dot Product of Two Sparse Vectors,Medium,89.9%,50.0%
41,https://leetcode.com/problems/first-missing-positive,First Missing Positive,Hard,42.4%,50.0%
208,https://leetcode.com/problems/implement-trie-prefix-tree,Implement Trie (Prefix Tree),Medium,69.2%,62.5%
